{
  "candidate_id": "REPLACE_ME",
  "asset_id": "REPLACE_ME",
  "asset_profile": "long_creature",
  "current_gate": "asset_art",
  "source": {
    "source_type": "original",
    "license_clearance": "cleared",
    "source_manifest_path": "source-manifest.json"
  },
  "notes": "Replace profile/gate/source before use."
}
