{
  "candidate_id": "asset-contract-long-creature-accepted",
  "asset_id": "jxm-long-dragon-v2",
  "asset_profile": "long_creature",
  "current_gate": "asset_art",
  "source": {
    "source_type": "original",
    "license_clearance": "cleared",
    "source_manifest_path": "source-manifest.json"
  },
  "notes": "Synthetic accepted control for required long-creature asset-art evidence."
}
